{
  "schemaVersion": 1,
  "project": {
    "name": "HelloTalk Design System",
    "projectId": "9bc8b570-f656-4b2e-b23c-bdc776f974b1"
  },
  "policy": "docs/claude-design-two-way-sync.md",
  "items": [
    {
      "id": "relay.foundation.tokens",
      "kind": "foundation",
      "ownerLayer": "relay",
      "repositoryPaths": [
        "DESIGN.md",
        "frontend/src/styles.scss",
        "frontend/src/app/services/theme.service.ts"
      ],
      "previewPaths": ["frontend/design-preview/foundations/tokens.html"],
      "claudeDesignPath": "foundations/tokens.html",
      "syncDirection": "reconcile",
      "lastReconciledCommit": "747e10455b282239a589e96ed208d3d78bc79d91",
      "implementationAudit": "ux-full-tree-spartan-convergence-2026-08-16; issue-1094-appearance-settings-2026-08-23; rtl-safe-area-padding-2026-08-26; pr-7588-correction-flashcard-context-2026-08-26",
      "requiredStates": ["light", "dark", "forced-colours", "accent-override"]
    },
    {
      "id": "relay.primitives.buttons",
      "kind": "primitive",
      "ownerLayer": "relay",
      "repositoryPaths": [
        "frontend/src/app/components/primitives/button-primary",
        "frontend/src/app/components/primitives/button-secondary",
        "frontend/src/app/components/primitives/gradient-button"
      ],
      "previewPaths": ["frontend/design-preview/components/primitives/buttons.html"],
      "claudeDesignPath": "components/primitives/buttons.html",
      "syncDirection": "reconcile",
      "lastReconciledCommit": "747e10455b282239a589e96ed208d3d78bc79d91",
      "implementationAudit": "ux-full-tree-spartan-convergence-2026-08-16; pr-7588-correction-flashcard-context-2026-08-26",
      "requiredStates": ["light", "dark", "focus-visible", "disabled", "390px", "rtl"]
    },
    {
      "id": "relay.primitives.card-inputs",
      "kind": "primitive",
      "ownerLayer": "relay",
      "repositoryPaths": [
        "frontend/src/app/components/primitives/card",
        "frontend/src/app/components/primitives/input",
        "frontend/src/app/components/primitives/textarea"
      ],
      "previewPaths": ["frontend/design-preview/components/primitives/card-inputs.html"],
      "claudeDesignPath": "components/primitives/card-inputs.html",
      "syncDirection": "reconcile",
      "lastReconciledCommit": "747e10455b282239a589e96ed208d3d78bc79d91",
      "implementationAudit": "ux-full-tree-spartan-convergence-2026-08-16; secure-component-identifiers-2026-08-18; card-consumer-role-override-2026-08-22; pr-7588-correction-flashcard-context-2026-08-26",
      "requiredStates": ["light", "dark", "focus-visible", "error", "390px", "rtl"]
    },
    {
      "id": "relay.primitives.chips-pills-badges",
      "kind": "primitive",
      "ownerLayer": "relay",
      "repositoryPaths": [
        "frontend/src/app/components/primitives/chip",
        "frontend/src/app/components/primitives/pill"
      ],
      "previewPaths": ["frontend/design-preview/components/primitives/chip-pill-badges.html"],
      "claudeDesignPath": "components/primitives/chip-pill-badges.html",
      "syncDirection": "reconcile",
      "lastReconciledCommit": "747e10455b282239a589e96ed208d3d78bc79d91",
      "implementationAudit": "ux-full-tree-spartan-convergence-2026-08-16; pr-7588-correction-flashcard-context-2026-08-26",
      "requiredStates": ["light", "dark", "390px", "rtl"]
    },
    {
      "id": "relay.primitives.feedback-states",
      "kind": "primitive",
      "ownerLayer": "relay",
      "repositoryPaths": ["frontend/src/app/components/primitives"],
      "previewPaths": ["frontend/design-preview/components/primitives/feedback-states.html"],
      "claudeDesignPath": "components/primitives/feedback-states.html",
      "syncDirection": "reconcile",
      "lastReconciledCommit": "747e10455b282239a589e96ed208d3d78bc79d91",
      "implementationAudit": "ux-full-tree-spartan-convergence-2026-08-16; secure-component-identifiers-2026-08-18; pr-7588-correction-flashcard-context-2026-08-26",
      "requiredStates": ["light", "dark", "error", "loading", "empty", "rtl"]
    },
    {
      "id": "relay.primitives.indicators-media",
      "kind": "primitive",
      "ownerLayer": "relay",
      "repositoryPaths": ["frontend/src/app/components/primitives"],
      "previewPaths": ["frontend/design-preview/components/primitives/indicators-media.html"],
      "claudeDesignPath": "components/primitives/indicators-media.html",
      "syncDirection": "reconcile",
      "lastReconciledCommit": "747e10455b282239a589e96ed208d3d78bc79d91",
      "implementationAudit": "ux-full-tree-spartan-convergence-2026-08-16; secure-component-identifiers-2026-08-18; pr-7588-correction-flashcard-context-2026-08-26",
      "requiredStates": ["light", "dark", "reduced-motion"]
    },
    {
      "id": "spartan.overlays-menus",
      "kind": "primitive",
      "ownerLayer": "spartan-helm",
      "repositoryPaths": ["frontend/src/app/components/ui/dialog"],
      "previewPaths": ["frontend/design-preview/components/primitives/overlays-menus.html"],
      "claudeDesignPath": "components/primitives/overlays-menus.html",
      "syncDirection": "reconcile",
      "lastReconciledCommit": "747e10455b282239a589e96ed208d3d78bc79d91",
      "implementationAudit": "ux-full-tree-spartan-convergence-2026-08-16; pr-7588-correction-flashcard-context-2026-08-26",
      "requiredStates": ["light", "dark", "focus-visible", "keyboard", "390px", "rtl", "400%-zoom"]
    },
    {
      "id": "spartan.component-system",
      "nonVisualMaintenanceAudit": {
        "commit": "d9380cdcd54bf7f823a3ed49374712b460676826",
        "designSync": "not-required",
        "reason": "PR 9456 repairs duplicate imports, uses framework-default change detection, narrows malformed realtime payloads and removes an unused test import. No template content, styles, tokens, controls or valid-publication behaviour changes. No preview or Claude Design reconciliation is claimed."
      },
      "kind": "primitive",
      "ownerLayer": "spartan-helm",
      "repositoryPaths": ["frontend/src/app/components"],
      "previewPaths": ["frontend/design-preview/components/component-system.html"],
      "claudeDesignPath": "components/component-system.html",
      "syncDirection": "reconcile",
      "lastReconciledCommit": "747e10455b282239a589e96ed208d3d78bc79d91",
      "implementationAudit": "ux-full-tree-spartan-convergence-2026-08-16; issue-594-grammar-explanation-dialog; issue-659-simplify-context-menu; merged-regression-repair-2026-08-18; secure-component-identifiers-2026-08-18; issue-6124-diagnostic-quiz-radio-group; issue-6115-device-lock-relay-tokens-2026-08-19; issue-6082-create-group-native-form-interactions-2026-08-19; issue-6179-events-calendar-spartan-controls-2026-08-19; issue-6164-emoji-picker-spartan-selection-2026-08-19; issue-6154-doodle-pad-spartan-selection-2026-08-19; issue-1713-voice-playback-speed-2026-08-20; appa11yclickable-explicit-tabindex-2026-08-20; issue-852-events-discovery-completion-2026-08-21; issue-6144-distance-slider-native-control-2026-08-21; quests-retry-hlmbtn-spartan-contract-2026-08-22; issue-1078-link-preview-rendering-2026-08-23; frontend-unit-baseline-repair-2026-08-25; issue-1467-dnd-quiet-hours-save-2026-08-26; issue-1721-voiceroom-create-modal-2026-08-26; canonical-ci-regression-repair-2026-08-26; issue-1702-liked-by-modal-contract-2026-08-26; liked-by-spartan-title-contract-2026-08-26; issue-757-direct-profile-chat-2026-08-26; issue-8222-api-base-urls-2026-08-28; issue-6134-discovery-error-boundary-spartan-controls-2026-08-21; issue-1032-diagnostic-quiz-completion-2026-08-21; issue-1664-quests-spartan-retry-2026-08-22; issue-6068-correction-modal-relay-tokens-2026-08-21; issue-1680-translate-bio-accessibility-2026-08-24; issue-6098-daily-login-modal-relay-tokens-2026-08-25; issue-1822-touchmove-cancellation-2026-08-27; document-viewer-accessibility-2026-08-27; issue-1742-incoming-call-lifecycle-2026-08-27; issue-8725-host-dashboard-room-binding-2026-09-07; issue-6116-device-lock-accessibility-2026-08-25; issue-966-visual-diff-rendering-2026-08-21; issue-6105-desktop-sidebar-relay-radii-2026-08-21; deduplicate-components-pages-specs-2026-09-12; pr-7588-correction-flashcard-context-2026-08-26",
      "requiredStates": [
        "light",
        "dark",
        "focus-visible",
        "disabled",
        "error",
        "390px",
        "rtl",
        "400%-zoom",
        "forced-colours",
        "reduced-motion"
      ]
    },
    {
      "id": "screen.shell",
      "kind": "screen",
      "ownerLayer": "feature",
      "repositoryPaths": ["frontend/src/app"],
      "previewPaths": ["frontend/design-preview/screens/shell.html"],
      "claudeDesignPath": "screens/shell.html",
      "syncDirection": "reconcile",
      "lastReconciledCommit": "747e10455b282239a589e96ed208d3d78bc79d91",
      "implementationAudit": "ux-full-tree-spartan-convergence-2026-08-16; issue-934-moderation-query-params-2026-08-26; issue-1721-voiceroom-create-modal-2026-08-26; bolt-bounded-chat-unread-fetch-2026-08-28; issue-6068-correction-modal-relay-tokens-2026-08-21; pr-7588-correction-flashcard-context-2026-08-26",
      "requiredStates": ["light", "dark", "390px", "wide", "rtl"]
    },
    {
      "id": "screen.home",
      "nonVisualMaintenanceAudit": {
        "commit": "d9380cdcd54bf7f823a3ed49374712b460676826",
        "designSync": "not-required",
        "reason": "PR 9456 removes duplicate Angular imports and redundant explicit OnPush metadata. Home templates, styles, layout and interaction contracts are unchanged. No preview or Claude Design reconciliation is claimed."
      },
      "kind": "screen",
      "ownerLayer": "feature",
      "repositoryPaths": ["frontend/src/app/pages/home"],
      "previewPaths": ["frontend/design-preview/screens/home.html"],
      "claudeDesignPath": "screens/home.html",
      "syncDirection": "reconcile",
      "lastReconciledCommit": "747e10455b282239a589e96ed208d3d78bc79d91",